[
  {
    "id": "enemy.bandit_warrior",
    "name": "enemy.bandit_warrior.name",
    "classId": "class.warrior",
    "baseStats": {
      "hp": 1000,
      "attack": 150,
      "defense": 120,
      "speed": 104,
      "critRate": 40,
      "critDamage": 1500,
      "accuracy": 0,
      "evasion": 0,
      "effectHit": 0,
      "effectResistance": 0
    },
    "skills": [
      "skill.warrior.slash",
      "skill.warrior.shield_bash",
      "skill.warrior.dawn_cleave"
    ],
    "sprite": "sprite:enemy/bandit_warrior",
    "tags": [
      "art_pending"
    ]
  },
  {
    "id": "enemy.bandit_assassin",
    "name": "enemy.bandit_assassin.name",
    "classId": "class.assassin",
    "baseStats": {
      "hp": 600,
      "attack": 200,
      "defense": 50,
      "speed": 128,
      "critRate": 160,
      "critDamage": 1500,
      "accuracy": 0,
      "evasion": 0,
      "effectHit": 0,
      "effectResistance": 0
    },
    "skills": [
      "skill.assassin.backstab",
      "skill.assassin.shadow_step",
      "skill.assassin.deathmark"
    ],
    "sprite": "sprite:enemy/bandit_assassin",
    "tags": [
      "art_pending"
    ]
  },
  {
    "id": "enemy.bandit_mage",
    "name": "enemy.bandit_mage.name",
    "classId": "class.mage",
    "baseStats": {
      "hp": 700,
      "attack": 250,
      "defense": 60,
      "speed": 107,
      "critRate": 60,
      "critDamage": 1500,
      "accuracy": 0,
      "evasion": 0,
      "effectHit": 0,
      "effectResistance": 0
    },
    "skills": [
      "skill.mage.fireball",
      "skill.mage.arcane_storm",
      "skill.mage.sunfall"
    ],
    "sprite": "sprite:enemy/bandit_mage",
    "tags": [
      "art_pending"
    ]
  },
  {
    "id": "enemy.bandit_ranger",
    "name": "enemy.bandit_ranger.name",
    "classId": "class.ranger",
    "baseStats": {
      "hp": 650,
      "attack": 220,
      "defense": 40,
      "speed": 122,
      "critRate": 120,
      "critDamage": 1500,
      "accuracy": 0,
      "evasion": 0,
      "effectHit": 0,
      "effectResistance": 0
    },
    "skills": [
      "skill.ranger.piercing_arrow",
      "skill.ranger.volley",
      "skill.ranger.arrow_rain"
    ],
    "sprite": "sprite:enemy/bandit_ranger",
    "tags": [
      "art_pending"
    ]
  },
  {
    "id": "enemy.bandit_support",
    "name": "enemy.bandit_support.name",
    "classId": "class.support",
    "baseStats": {
      "hp": 750,
      "attack": 80,
      "defense": 60,
      "speed": 110,
      "critRate": 20,
      "critDamage": 1500,
      "accuracy": 0,
      "evasion": 0,
      "effectHit": 0,
      "effectResistance": 0
    },
    "skills": [
      "skill.support.lamp_strike",
      "skill.support.mend",
      "skill.support.swift_hymn"
    ],
    "sprite": "sprite:enemy/bandit_support",
    "tags": [
      "art_pending"
    ]
  },
  {
    "id": "enemy.bandit_tank",
    "name": "enemy.bandit_tank.name",
    "classId": "class.tank",
    "baseStats": {
      "hp": 1200,
      "attack": 70,
      "defense": 200,
      "speed": 95,
      "critRate": 20,
      "critDamage": 1500,
      "accuracy": 0,
      "evasion": 0,
      "effectHit": 0,
      "effectResistance": 0
    },
    "skills": [
      "skill.tank.shield_slam",
      "skill.tank.provoke",
      "skill.tank.iron_wall"
    ],
    "sprite": "sprite:enemy/bandit_tank",
    "tags": [
      "art_pending"
    ]
  }
]
